{
  "version": 1,
  "run_id": "veritas-repo-check-in",
  "team_profile_id": "veritas-default",
  "mode": "shadow",
  "evidence": {
    "artifact_path": ".veritas/evidence/veritas-repo-check-in.json",
    "artifact_digest": "297a32fa6316b174966916eafef523c0a70bd97362920b747f373cb0538af236",
    "timestamp": "2026-04-21T22:00:00.000Z",
    "source_ref": "refs/heads/main",
    "source_kind": "explicit-files",
    "source_scope": [
      "explicit"
    ],
    "affected_nodes": [
      "app.src",
      "docs.docs",
      "governance.guidance",
      "governance.root-manifests",
      "governance.schemas",
      "tooling.bin",
      "verification.tests"
    ],
    "affected_lanes": [
      ".veritas/**",
      "bin/**",
      "docs/**",
      "root manifests",
      "schemas/**",
      "src/**",
      "tests/**"
    ],
    "unresolved_files": [],
    "policy_results": [
      {
        "rule_id": "required-veritas-operational-artifacts",
        "classification": "hard-invariant",
        "stage": "block",
        "enforcement": "deny",
        "message": "The tracked Veritas operational artifacts must stay present so agents and reviewers share the same baseline.",
        "owner": "repo-core",
        "rollback_switch": null,
        "implemented": true,
        "passed": true,
        "status": "info",
        "summary": "All required repository artifacts are present.",
        "findings": []
      },
      {
        "rule_id": "required-veritas-cli-artifacts",
        "classification": "hard-invariant",
        "stage": "block",
        "enforcement": "deny",
        "message": "The shipped Veritas CLI entrypoints and package manifest must stay present.",
        "owner": "repo-core",
        "rollback_switch": null,
        "implemented": true,
        "passed": true,
        "status": "info",
        "summary": "All required repository artifacts are present.",
        "findings": []
      },
      {
        "rule_id": "required-veritas-reference-artifacts",
        "classification": "hard-invariant",
        "stage": "block",
        "enforcement": "deny",
        "message": "The repo must keep the docs that explain the shipped Veritas surface.",
        "owner": "repo-core",
        "rollback_switch": null,
        "implemented": true,
        "passed": true,
        "status": "info",
        "summary": "All required repository artifacts are present.",
        "findings": []
      },
      {
        "rule_id": "required-veritas-schema-artifacts",
        "classification": "hard-invariant",
        "stage": "block",
        "enforcement": "deny",
        "message": "The shipped Veritas schema set must stay present and reviewable.",
        "owner": "repo-core",
        "rollback_switch": null,
        "implemented": true,
        "passed": true,
        "status": "info",
        "summary": "All required repository artifacts are present.",
        "findings": []
      },
      {
        "rule_id": "ai-instruction-files-synced",
        "classification": "hard-invariant",
        "stage": "warn",
        "enforcement": "deny",
        "message": "All required AI tool instruction files must contain the Veritas governance block.",
        "owner": "repo-maintainers",
        "rollback_switch": null,
        "implemented": true,
        "passed": true,
        "status": "info",
        "summary": "All required AI instruction files contain the canonical Veritas governance block.",
        "findings": []
      },
      {
        "rule_id": "prefer-veritas-routed-delivery",
        "classification": "promotable-policy",
        "stage": "recommend",
        "enforcement": "lint",
        "message": "Prefer keeping the tracked Veritas proof and check-in integration surfaces present so changes flow through the documented operational path before review.",
        "owner": "repo-maintainers",
        "rollback_switch": "soften-veritas-route",
        "implemented": true,
        "passed": true,
        "status": "info",
        "summary": "All required repository artifacts are present.",
        "findings": []
      },
      {
        "rule_id": "no-console-log-in-src",
        "classification": "advisory-pattern",
        "stage": "warn",
        "enforcement": "lint",
        "message": "Source files should not leave console.log diagnostics behind.",
        "owner": "repo-maintainers",
        "rollback_switch": "allow-console-log",
        "implemented": true,
        "passed": true,
        "status": "info",
        "summary": "No matched files contain forbidden pattern console\\.log.",
        "findings": []
      }
    ]
  },
  "governance": {
    "surface_touched": true,
    "classification": "unknown",
    "human_review_required": false,
    "changed_paths": [
      ".veritas/GOVERNANCE.md",
      ".veritas/repo.adapter.json",
      ".veritas/policy-packs/default.policy-pack.json",
      ".veritas/team/default.team-profile.json"
    ]
  },
  "reviewer_confidence_scale": [
    "low",
    "medium",
    "high",
    "unknown"
  ],
  "prefilled_outcome": {
    "reviewer_confidence": "high"
  },
  "prefilled_measurements": {
    "time_to_green_minutes": 12,
    "override_count": 0,
    "false_positive_rules": [],
    "missed_issues": []
  },
  "notes": [
    "This example is generated from the Veritas repo using its tracked .veritas config.",
    "The goal is to show a self-hosted report and eval flow without making local evidence outputs part of the distributed package."
  ],
  "missing_confirmation_fields": [
    "accepted_without_major_rewrite",
    "required_followup"
  ]
}
